{
  "schema_version": "0.1.0",
  "scene_id": "rtf-2026-02-11-ams-cycling-01",
  "scenario": "vru_cyclist_urban",
  "description": "Cycling through mixed traffic in the canal district during the morning rush.",
  "capture": {
    "start_utc": "2026-02-11T08:14:22.045Z",
    "start_utc_source": "gps",
    "country": "NL",
    "locality": "Amsterdam",
    "mode": "bicycle",
    "setting": "urban",
    "lighting": "daylight",
    "weather": "overcast",
    "surface": "asphalt bike lane"
  },
  "rig": {
    "world": {
      "device": "GoPro HERO13 Black",
      "config": "A",
      "mount": "chest",
      "lens": "HB-Series Ultra-Wide Lens Mod",
      "fov_deg": 177,
      "resolution": [3840, 2160],
      "fps": 59.94,
      "color_profile": "GP-Log 10-bit",
      "telemetry": ["ACCL", "GYRO", "GPS9"]
    },
    "pov": {
      "device": "Ray-Ban Meta Gen 2",
      "config": "C1",
      "mount": "head",
      "resolution": [2192, 2928],
      "fps": 30,
      "eye_tracking": false
    }
  },
  "files": {
    "world": [
      { "path": "world/GX010492.MP4", "start_s": 0.0, "duration_s": 1062.4 },
      { "path": "world/GX020492.MP4", "start_s": 1062.4, "duration_s": 418.1 }
    ],
    "pov": [
      {
        "path": "pov/RM010492_01.mp4",
        "offset_s": 1.734,
        "duration_s": 178.3,
        "alignment": { "method": "audio_xcorr", "ncc": 0.71, "peak_ratio": 4.2 }
      },
      {
        "path": "pov/RM010492_02.mp4",
        "offset_s": 412.906,
        "duration_s": 176.9,
        "alignment": { "method": "audio_xcorr", "ncc": 0.64, "peak_ratio": 3.6 }
      },
      {
        "path": "pov/RM010492_03.mp4",
        "offset_s": 1004.512,
        "duration_s": 179.0,
        "alignment": { "method": "audio_xcorr", "ncc": 0.69, "peak_ratio": 3.9 }
      }
    ]
  },
  "privacy": {
    "anonymized": false,
    "wearer_consent": true
  },
  "notes": "Illustrative example. Values show the format and do not describe a real delivery."
}
